<?xml version="1.0" encoding="UTF-8"?>
<?xml-stylesheet href="clasificacion.xsl" type="text/xsl"?>
<clasificacion xmlns:xsi="http://www.w3.org/2001/XMLSchema-instance" xsi:noNamespaceSchemaLocation="clasificacion.xsd">
<fila id="1">
 <posicion>1</posicion>
<equipo>
<logo>../media/Imagenes/logos/all_blacks_badge_white.png</logo>
<nombre>AllBlacks</nombre>
</equipo>
<partidos>10</partidos>
<victorias>8</victorias>
<derrotas>2</derrotas>
<empates>0</empates>
<puntos>435</puntos>
</fila>
<fila id="2">
 <posicion>2</posicion>
<equipo>
<logo>../media/Imagenes/logos/south_Africa_national_rugby_union_team.png</logo>
<nombre>Springboks</nombre>
</equipo>
<partidos>10</partidos>
<victorias>6</victorias>
<derrotas>4</derrotas>
<empates>0</empates>
<puntos>546</puntos>
</fila>
<fila id="3">
 <posicion>3</posicion>
<equipo>
<logo>../media/Imagenes/logos/sakuras-logo.png</logo>
<nombre>Sakuras</nombre>
</equipo>
<partidos>10</partidos>
<victorias>5</victorias>
<derrotas>4</derrotas>
<empates>1</empates>
<puntos>665</puntos>
</fila>
<fila id="4">
 <posicion>4</posicion>
<equipo>
<logo>../media/Imagenes/logos/shamrock-logo.png</logo>
<nombre>Shamrock</nombre>
</equipo>
<partidos>10</partidos>
<victorias>5</victorias>
<derrotas>5</derrotas>
<empates>0</empates>
<puntos>431</puntos>
</fila>
<fila id="5">
 <posicion>5</posicion>
<equipo>
<logo>../media/Imagenes/logos/red_rose_logo.png</logo>
<nombre>RedRose</nombre>
</equipo>
<partidos>10</partidos>
<victorias>3</victorias>
<derrotas>7</derrotas>
<empates>0</empates>
<puntos>402</puntos>
</fila>
<fila id="6">
 <posicion>6</posicion>
<equipo>
<logo>../media/Imagenes/logos/wallabies-logo.png</logo>
<nombre>Wallabies</nombre>
</equipo>
<partidos>10</partidos>
<victorias>2</victorias>
<derrotas>7</derrotas>
<empates>1</empates>
<puntos>500</puntos>
</fila>
</clasificacion>
